id,source,target,relation,category,harmony_score,description_ko,description_en,insight_template
TCS_016,TAROT_COURT_Page_Pentacles,SAJU_SIPSIN_식신,타로십신,court_sipsin,86,"펜타클 페이지는 식신(食神)과 공명합니다. 실용적 학습과 기술 습득에 대한 순수한 열정을 가진 존재입니다. 한 걸음씩 배우며 성장하고, 물질 세계에서 기쁨을 찾습니다.",Page of Pentacles resonates with Eating God(食神) — diligent learner finding joy in craft.,"당신의 궁정 카드 '펜타클 페이지'가 사주의 '{target}'과 만났습니다. 배움에 대한 순수한 열정이 현실적 성과로 이어집니다. 한 걸음씩 꾸준히 성장하세요."
# --- Court Cards: Wands/Pentacles Courts → 정재/편재 (Wealth connections) ---
TCS_017,TAROT_COURT_King_Wands,SAJU_SIPSIN_편재,타로십신,court_sipsin,83,"완드 킹은 편재(偏財)와도 공명합니다. 과감한 투자와 모험적 사업을 통해 큰 부를 일구는 기업가의 기운입니다. 기회를 포착하는 직감과 배팅하는 배짱이 있습니다.",King of Wands also resonates with Indirect Wealth(偏財) — entrepreneurial fortune through bold ventures.,"당신의 '완드 킹' 에너지에 사주의 '{target}' 기운이 더해졌습니다. 과감한 도전이 큰 재물로 돌아옵니다. 기회를 보는 눈을 믿고 배팅하세요."
TCS_018,TAROT_COURT_King_Pentacles,SAJU_SIPSIN_정재,타로십신,court_sipsin,95,"펜타클 킹은 정재(正財)와도 공명합니다. 안정적이고 체계적인 자산 관리로 부를 축적하는 대부호의 기운입니다. 검증된 방법으로 꾸준히 재산을 불려갑니다.",King of Pentacles also resonates with Direct Wealth(正財) — systematic wealth accumulation.,"당신의 '펜타클 킹' 에너지에 사주의 '{target}' 기운이 더해졌습니다. 안정적이고 체계적인 자산 관리가 큰 부를 만듭니다. 검증된 길을 꾸준히 가세요."
TCS_019,TAROT_COURT_Queen_Wands,SAJU_SIPSIN_편재,타로십신,court_sipsin,80,"완드 퀸은 편재(偏財)와도 공명합니다. 직관과 매력을 활용한 사업적 수완이 있으며, 인맥을 통한 재물운이 따릅니다. 비정형적인 방식으로 풍요를 끌어들입니다.",Queen of Wands also resonates with Indirect Wealth(偏財) — charisma-driven fortune.,"당신의 '완드 퀸' 에너지에 사주의 '{target}' 기운이 더해졌습니다. 매력과 직관이 재물을 끌어당깁니다. 인맥과 영감을 활용한 사업에 기회가 있습니다."
TCS_020,TAROT_COURT_Queen_Pentacles,SAJU_SIPSIN_정재,타로십신,court_sipsin,92,"펜타클 퀸은 정재(正財)와도 공명합니다. 실용적인 살림 감각과 안정적인 자산 운용 능력이 있습니다. 풍요로운 가정과 재정적 안정을 만들어내는 현실적 지혜입니다.",Queen of Pentacles also resonates with Direct Wealth(正財) — practical prosperity and financial security.,"당신의 '펜타클 퀸' 에너지에 사주의 '{target}' 기운이 더해졌습니다. 실용적 감각으로 안정적인 풍요를 만듭니다. 현실적 지혜가 재정적 안정의 열쇠입니다."
TCS_021,TAROT_COURT_Knight_Wands,SAJU_SIPSIN_편재,타로십신,court_sipsin,78,"완드 나이트는 편재(偏財)와도 공명합니다. 새로운 시장을 개척하고 모험적 투자에 뛰어드는 에너지입니다. 빠른 판단으로 기회를 선점하는 투기적 재운이 있습니다.",Knight of Wands also resonates with Indirect Wealth(偏財) — speculative fortune through pioneering.,"당신의 '완드 나이트' 에너지에 사주의 '{target}' 기운이 더해졌습니다. 빠른 판단과 모험이 재물 기회를 엽니다. 새로운 영역에서 선점의 이점을 잡으세요."
TCS_022,TAROT_COURT_Knight_Pentacles,SAJU_SIPSIN_정재,타로십신,court_sipsin,85,"펜타클 나이트는 정재(正財)와도 공명합니다. 꾸준한 노동과 성실함으로 정당한 대가를 받는 에너지입니다. 한 푼 한 푼 모아 큰 재산을 만드는 근면의 재운입니다.",Knight of Pentacles also resonates with Direct Wealth(正財) — earned fortune through diligence.,"당신의 '펜타클 나이트' 에너지에 사주의 '{target}' 기운이 더해졌습니다. 성실한 노력이 정당한 보상으로 돌아옵니다. 꾸준함이 부의 비결입니다."
TCS_023,TAROT_COURT_Page_Wands,SAJU_SIPSIN_편재,타로십신,court_sipsin,75,"완드 페이지는 편재(偏財)와도 공명합니다. 새로운 아이디어와 사업 기회를 발견하는 눈이 있으며, 작은 시도가 예상치 못한 큰 수익으로 이어질 수 있습니다.",Page of Wands also resonates with Indirect Wealth(偏財) — discovering unexpected opportunities.,"당신의 '완드 페이지' 에너지에 사주의 '{target}' 기운이 더해졌습니다. 호기심에서 시작된 작은 시도가 뜻밖의 기회를 엽니다. 새로운 가능성을 탐색하세요."
TCS_024,TAROT_COURT_Page_Pentacles,SAJU_SIPSIN_정재,타로십신,court_sipsin,82,"펜타클 페이지는 정재(正財)와도 공명합니다. 재정 관리의 기초를 배우고 첫 번째 자산을 쌓기 시작하는 에너지입니다. 금전적 감각이 싹트며 미래 부의 씨앗을 심습니다.",Page of Pentacles also resonates with Direct Wealth(正財) — planting the seeds of future prosperity.,"당신의 '펜타클 페이지' 에너지에 사주의 '{target}' 기운이 더해졌습니다. 재정적 감각이 자라나고 있습니다. 지금 심는 작은 씨앗이 큰 풍요가 됩니다."