id,label,type,element,description,career,wealth,relationship,health,advice
DU_목운,목운 대운,daeun,목,"목(木) 대운이 들어오면 성장과 확장의 시기. 새로운 시작, 계획 수립, 학습에 유리한 10년.","새로운 사업 시작, 창업, 교육 분야, 기획직, 연구직에 유리. 목표를 세우고 추진하기 좋은 시기.","투자보다 준비의 시기. 씨앗을 뿌리는 단계로 당장의 수확보다 미래 성장에 투자.","새로운 인연이 많아짐. 인맥 확장, 사교 활동 활발. 연애운 상승.","간, 담, 눈 건강 주의. 스트레스로 인한 두통, 신경성 질환 조심.","성급하게 결과를 바라지 말고 꾸준히 성장하세요. 배움에 투자하면 10년 후 큰 열매."
DU_화운,화운 대운,daeun,화,"화(火) 대운이 들어오면 열정과 표현의 시기. 명예, 인기, 사회적 인정을 받기 좋은 10년.","승진, 명예직, 예술, 연예, 마케팅, 홍보 분야에 유리. 자신을 드러내기 좋은 시기.","투자 수익 실현, 사업 확장에 유리. 다만 과욕은 금물. 화려하지만 지출도 많을 수 있음.","연애 열정 상승. 결혼, 출산에 좋은 시기. 다만 감정 기복 주의.","심장, 혈압, 눈 건강 주의. 화병, 불면, 과로 조심. 열 관련 질환 주의.","열정을 쏟되 번아웃 주의. 적당한 휴식과 냉정함 유지가 성공의 열쇠."
DU_토운,토운 대운,daeun,토,"토(土) 대운이 들어오면 안정과 결실의 시기. 기반을 다지고 수확을 거두는 10년.","부동산, 건설, 농업, 중개업, 관리직에 유리. 안정적인 직장생활, 승진에 좋음.","부동산 투자, 저축에 유리. 안정적인 수입과 재산 축적의 시기.","결혼, 가정 안정에 좋은 시기. 가족 화합, 집안 대소사 원만히 해결.","소화기, 위장, 피부 건강 주의. 비만, 당뇨 조심. 규칙적인 식사 중요.","변화보다 안정 추구. 기존 것을 지키고 발전시키는 데 집중하세요."
DU_금운,금운 대운,daeun,금,"금(金) 대운이 들어오면 결단과 정리의 시기. 과감한 변화와 수확, 정리의 10년.","금융, 법조, 군경, 의료, 기계, IT 분야에 유리. 칼처럼 날카로운 결단력 발휘.","투자 수익 실현, 정리정돈의 시기. 불필요한 지출 줄이고 알짜배기만 남기기.","결단이 필요한 관계 정리. 인연의 이별과 새 만남이 교차. 냉정한 판단 필요.","폐, 대장, 피부, 호흡기 건강 주의. 감기, 알레르기, 피부질환 조심.","과감한 결단이 필요한 시기. 미련 없이 정리하고 새 출발 준비하세요."
DU_수운,수운 대운,daeun,수,"수(水) 대운이 들어오면 지혜와 축적의 시기. 내면을 돌아보고 실력을 쌓는 10년.","학문, 연구, 예술, 철학, 유통, 무역, 해외 관련 업종에 유리.","숨은 재물 발견, 투자 공부에 좋은 시기. 눈에 보이지 않는 자산 축적.","깊은 인연 형성. 표면적 관계보다 진정한 인연. 오래된 인연 재회 가능.","신장, 방광, 생식기, 허리 건강 주의. 냉증, 부종, 요통 조심.","조용히 내실을 다지세요. 드러나지 않아도 실력을 쌓으면 때가 옵니다."
